### ISSUE TITLE
'ccm nodeX stress' fails on --ipprefix clusters

### ISSUE THREAD

**Issue by mshuler** [pcmanus/ccm#104]
repro:

```
ccm create -v 2.0.6 -n3 -i 127.1.1. 12711test
ccm node1 stress
```

(originally, I was tinkering with dummy interfaces when I found this - the above is simpler and suffers the same problem)

```
#!/bin/sh
PREFIX="192.168.0."
for i in 1 2 3; do
  sudo ip link add ccm${i} type dummy
  sudo ip addr add ${PREFIX}${i}/32 dev ccm${i}
  sudo ip link set ccm${i} up
done

ccm create -v 2.0.5 -n3 -i ${PREFIX} ipptest
ccm start
ccm stress  # this works
ccm node1 stress  # tcpdump shows this tries 127.0.0.1:9160 - same with node2,node3
```

```
mshuler@buildbot-ccm:~$ ccm node1 stress
Exception in thread "Thread-2" java.lang.RuntimeException: java.net.ConnectException: Connection refused
        at org.apache.cassandra.stress.Session.getClient(Session.java:816)
        at org.apache.cassandra.stress.Session.createKeySpaces(Session.java:730)
        at org.apache.cassandra.stress.StressAction.run(StressAction.java:64)
```

```
15:57:05.819347 IP 192.168.0.3.7000 > 192.168.0.3.58556: Flags [.], ack 995, win 1594, options [nop,nop,TS val 3299779 ecr 3299779], length 0
15:57:06.146777 IP 127.0.0.1.45374 > 127.0.0.1.9160: Flags [S], seq 3238651223, win 32792, options [mss 16396,sackOK,TS val 3299861 ecr 0,nop,wscale 5], length 0
15:57:06.146790 IP 127.0.0.1.9160 > 127.0.0.1.45374: Flags [R.], seq 0, ack 3238651224, win 0, length 0
15:57:06.539201 IP 192.168.0.2.40598 > 192.168.0.2.7000: Flags [P.], seq 719:841, ack 1, win 1025, options [nop,nop,TS val 3299959 ecr 3299779], length 122
15:57:06.539307 IP 192.168.0.2.7000 > 192.168.0.2.40598: Flags [.], ack 841, win 1795, options [nop,nop,TS val 3299959 ecr 3299959], length 0
```

manually running cassandra-stress against the node is fine:

```
mshuler@buildbot-ccm:~$ cassandra-stress -d 192.168.0.1
Unable to create stress keyspace: Keyspace names must be case-insensitively unique ("Keyspace1" conflicts with "Keyspace1")
total,interval_op_rate,interval_key_rate,latency,95th,99.9th,elapsed_time
11878,1187,1187,12.1,143.7,293.7,10
38853,2697,2697,8.9,106.6,246.4,20
<...>
```
